{
  "$schema": "https://json-schema.org/draft/2020-12/schema",
  "title": "Language lexicon (lexicon.json) v1",
  "$comment": "Plans/Kotlin/EnRuPackPlan.md §5 gap B / UniversalCorePlan.md §3.1 UC-12: lexicon.json is language-scoped lemmas+forms (nouns/adjectives/verbs/personalPronouns/possessives, plus optional morphology/stemAlternations). Deliberately loose on `forms`' own shape: pl's noun/adjective/possessive forms are deep Case×Number(×Gender) tables and its verbs are `present`/`pastStem` objects, while en's are flat invariant/Number-only strings (EnRuPackPlan.md §1.3) — both are valid lexicalized tables for :core-engine's TableMorphology (arbitrary category+lexeme+feature-key lookup, gap B: 'not a gap'), so this schema checks the lexicon's own shape (ids unique-ish, required categories present, forms non-empty), not a fixed per-language form vocabulary. scripts/validate-pack-v2.mjs additionally re-validates pl's lexicon.json via the stricter course-pack-v1.schema.json reconstruction; this schema is the first check that applies to every lang/<code>/lexicon.json, pl included.",
  "type": "object",
  "additionalProperties": false,
  "required": ["schemaVersion", "nouns", "adjectives", "verbs", "personalPronouns", "possessives"],
  "properties": {
    "schemaVersion": { "const": 1 },
    "$comment": { "type": "string" },
    "nouns": { "type": "array", "minItems": 1, "items": { "$ref": "#/$defs/lexeme" } },
    "adjectives": { "type": "array", "minItems": 1, "items": { "$ref": "#/$defs/lexeme" } },
    "verbs": { "type": "array", "minItems": 1, "items": { "$ref": "#/$defs/verbLexeme" } },
    "personalPronouns": {
      "type": "object",
      "minProperties": 1,
      "additionalProperties": { "type": "object", "minProperties": 1 }
    },
    "possessives": { "type": "array", "minItems": 1, "items": { "$ref": "#/$defs/possessive" } },
    "morphology": { "type": "object" },
    "stemAlternations": { "type": "array" }
  },
  "$defs": {
    "lexeme": {
      "type": "object",
      "additionalProperties": true,
      "required": ["id", "lemma", "meaning", "forms"],
      "properties": {
        "id": { "type": "string", "minLength": 1 },
        "lemma": { "type": "string", "minLength": 1 },
        "meaning": { "type": "string", "minLength": 1 },
        "forms": { "type": "object", "minProperties": 1 }
      }
    },
    "verbLexeme": {
      "type": "object",
      "additionalProperties": true,
      "required": ["id", "lemma", "meaning"],
      "properties": {
        "id": { "type": "string", "minLength": 1 },
        "lemma": { "type": "string", "minLength": 1 },
        "meaning": { "type": "string", "minLength": 1 }
      }
    },
    "possessive": {
      "type": "object",
      "additionalProperties": true,
      "required": ["id", "label", "forms"],
      "properties": {
        "id": { "type": "string", "minLength": 1 },
        "label": { "type": "string", "minLength": 1 },
        "forms": {
          "type": "object",
          "required": ["kind"],
          "properties": { "kind": { "type": "string", "minLength": 1 } }
        }
      }
    }
  }
}
